{
  "format": "c3s.pattern/1",
  "id": "p002-one-ulp-past-the-overlap",
  "title": "One ulp past the edge of the binocular overlap",
  "question": "The model's binocular rule is a hard edge: each eye sees its own hemifield plus 30 degrees across the midline. What does the smallest representable step across that edge do to an episode?",
  "how_found": "Constructed, not searched: azimuth math.nextafter(30.0, math.inf) = 30.000000000000004, the next double above 30, at l/v 20.0 ms. Its twin at exactly 30.0 degrees is the stimulus one ulp below.",
  "discoverer": "c3s-reflex maintainers",
  "date": "2026-09-16",
  "circuit": {
    "name": "core-hand-abc",
    "policy": "policy-hand-abc",
    "netlist_sha256": "7c8eaf62495908c434206ff54aa1f3e9146b4295506f59584d6107d2104b2e52",
    "domain_chain_sha256": "0x477aee38d33c82b3c223961f040a99b186ebb49edcb36cd7f17f3548fba1e1ea",
    "encoding": "4bit-log",
    "tick_ms": 5.0
  },
  "stimulus": {
    "kind": "loom",
    "l_over_v_ms": 20.0,
    "azimuth_deg": 30.000000000000004,
    "start_deg": 10.0,
    "end_deg": 170.0
  },
  "result": {
    "ticks": 38,
    "ended": "long-mode takeoff",
    "takeoff_tick": 37,
    "states_entered": [0, 1, 2, 3, 4]
  },
  "trace": {
    "fields": [
      "tick",
      "sensory",
      "policy",
      "state",
      "motor",
      "next_state"
    ],
    "sha256": "0c167c47f1d7273a15d29b0ce792f20e84f7c85aac2f6773d8ba09348ae776b9",
    "rows": [
      [0, 73984, 0, 0, 0, 0],
      [1, 73984, 0, 0, 0, 0],
      [2, 73984, 0, 0, 0, 0],
      [3, 73984, 0, 0, 0, 0],
      [4, 73984, 0, 0, 0, 0],
      [5, 73984, 0, 0, 0, 0],
      [6, 78080, 0, 0, 0, 0],
      [7, 78080, 0, 0, 0, 0],
      [8, 78080, 0, 0, 0, 0],
      [9, 78336, 0, 0, 0, 0],
      [10, 78336, 0, 0, 0, 0],
      [11, 78336, 0, 0, 0, 0],
      [12, 78336, 0, 0, 0, 0],
      [13, 78336, 0, 0, 0, 0],
      [14, 82432, 0, 0, 0, 0],
      [15, 82688, 0, 0, 0, 0],
      [16, 82688, 0, 0, 0, 0],
      [17, 82688, 0, 0, 0, 0],
      [18, 82688, 0, 0, 0, 0],
      [19, 82688, 0, 0, 0, 0],
      [20, 86784, 0, 0, 0, 0],
      [21, 87040, 0, 0, 0, 0],
      [22, 87040, 0, 0, 0, 0],
      [23, 87040, 0, 0, 0, 0],
      [24, 87040, 0, 0, 0, 0],
      [25, 91392, 0, 0, 0, 0],
      [26, 91392, 0, 0, 0, 0],
      [27, 91392, 0, 0, 0, 0],
      [28, 91392, 0, 0, 0, 0],
      [29, 95744, 0, 0, 0, 0],
      [30, 95744, 0, 0, 0, 0],
      [31, 95744, 0, 0, 0, 0],
      [32, 96000, 0, 0, 0, 0],
      [33, 100096, 2, 0, 1, 1],
      [34, 100096, 2, 1, 1, 2],
      [35, 104448, 2, 2, 1, 3],
      [36, 104448, 2, 3, 1, 4],
      [37, 104704, 3, 4, 3, 56]
    ]
  },
  "geometry": {
    "informational": true,
    "note": "Angular size and expansion speed at the first and last tick, in degrees and degrees per second. Each host computes these with its own atan and tan, so they are compared with a tolerance and are not part of trace.sha256.",
    "fields": [
      "tick",
      "theta_deg",
      "dtheta_dps"
    ],
    "first_tick": [0, 10.0, 43.522581686],
    "last_tick": [37, 49.282282115, 995.993119789]
  },
  "replay": "scripts/pattern_replay.py patterns/records/p002-one-ulp-past-the-overlap.json",
  "notes": [
    "At azimuth 30.0 both eyes see the stimulus and the episode ends in a long-mode takeoff on tick 33 (34 ticks). One ulp higher, the right eye alone sees it: the sensory word differs on every one of those 34 shared ticks, the first motor command to differ is tick 29, and the takeoff moves four ticks later, to tick 37 (38 ticks).",
    "Both hosts must round the decimal 30.000000000000004 to the same double for this to replay; tests/test_firmware.py already checks that the two builds' encodings agree one ulp either side of every bin edge and of the binocular overlap.",
    "This is the longest the two eyes' 8-bit fields can disagree in this episode: after this azimuth the right field stays zero for the whole run."
  ]
}
