{
  "format": "c3s.pattern/1",
  "id": "p001-smallest-long-mode",
  "title": "The smallest l/v that still ends in a long-mode takeoff",
  "question": "Short-mode takeoff is the fast escape and needs no wing raise; long mode needs four consecutive raising ticks first. A fast approach (small l/v) crosses the GF threshold early, so it should always take the short mode. What is the smallest l/v that still ends in a long-mode takeoff?",
  "how_found": "Exhaustive search of the grid l/v in {1.0, 1.1, ..., 20.0} ms x azimuth in {-90, -89, ..., 90} degrees: 34,571 episodes, 12,051 of which end in a long-mode takeoff. Of those, the smallest l/v, then the smallest azimuth.",
  "discoverer": "c3s-reflex maintainers",
  "date": "2026-09-16",
  "circuit": {
    "name": "core-hand-abc",
    "policy": "policy-hand-abc",
    "netlist_sha256": "7c8eaf62495908c434206ff54aa1f3e9146b4295506f59584d6107d2104b2e52",
    "domain_chain_sha256": "0x477aee38d33c82b3c223961f040a99b186ebb49edcb36cd7f17f3548fba1e1ea",
    "encoding": "4bit-log",
    "tick_ms": 5.0
  },
  "stimulus": {
    "kind": "loom",
    "l_over_v_ms": 8.8,
    "azimuth_deg": 31.0,
    "start_deg": 10.0,
    "end_deg": 170.0
  },
  "result": {
    "ticks": 16,
    "ended": "long-mode takeoff",
    "takeoff_tick": 15,
    "states_entered": [0, 1, 2, 3, 4]
  },
  "trace": {
    "fields": [
      "tick",
      "sensory",
      "policy",
      "state",
      "motor",
      "next_state"
    ],
    "sha256": "253ff8930990b4b4ef2bb95ec9dea8f8c80e1ad8509a5a3d7047f5169fef2a56",
    "rows": [
      [0, 82176, 0, 0, 0, 0],
      [1, 82176, 0, 0, 0, 0],
      [2, 82176, 0, 0, 0, 0],
      [3, 86272, 0, 0, 0, 0],
      [4, 86528, 0, 0, 0, 0],
      [5, 86528, 0, 0, 0, 0],
      [6, 86528, 0, 0, 0, 0],
      [7, 90880, 0, 0, 0, 0],
      [8, 90880, 0, 0, 0, 0],
      [9, 95232, 0, 0, 0, 0],
      [10, 95232, 0, 0, 0, 0],
      [11, 99584, 2, 0, 1, 1],
      [12, 99584, 2, 1, 1, 2],
      [13, 103936, 2, 2, 1, 3],
      [14, 104192, 2, 3, 1, 4],
      [15, 108288, 3, 4, 3, 56]
    ]
  },
  "geometry": {
    "informational": true,
    "note": "Angular size and expansion speed at the first and last tick, in degrees and degrees per second. Each host computes these with its own atan and tan, so they are compared with a tolerance and are not part of trace.sha256.",
    "fields": [
      "tick",
      "theta_deg",
      "dtheta_dps"
    ],
    "first_tick": [0, 10.0, 98.914958377],
    "last_tick": [15, 37.962211455, 1377.594771625]
  },
  "replay": "scripts/pattern_replay.py patterns/records/p001-smallest-long-mode.json",
  "notes": [
    "The boundary is not monotonic in l/v: on this grid only 8.8, 9.3 and 9.4 ms produce a long mode below 9.5 ms. At the same azimuth, 8.9 through 9.2 ms end in a short-mode takeoff.",
    "Azimuth 31 degrees is the first degree outside the modelled 30-degree binocular overlap, so only the right eye sees the stimulus. In MaleCNS v1.0 the right giant fiber receives fewer LC4 and LPLC2 synapses than the left (55 and 91 cells against 71 and 94), so the right eye alone is the weakest drive the model has: weak enough to raise wings for four ticks before the GF pathway crosses.",
    "The mirror stimulus at azimuth -31 degrees, seen by the stronger left eye alone, ends in a short-mode takeoff instead."
  ]
}
